"순번","민원제목","민원내용","민원등록일","민원수정일","민원답변일","처리부서","진행상태","민원인주소_법정동"
740,"(SPP-1711-1500849)가로등점멸 * 첨부파일촬영시간 안내(안전신문고 운영관","전라북도 부안군 부안읍 선은리 222-2가로등점멸*  *(1/1) C: 2017/11/15 22:52:49G:*","2017-11-15",,"2017-11-17","부안읍","처리완료","부안읍"
741,"전주시와 (주) 비상교육 간 '다문화 가정 온라인 한국어 교육"""""""" 제휴 제안","관공서(주민자치센터) 올바른 손씻기 요령 포스터 게시로 주민건강 지킨다","2016-01-19",,,"기획예산과","처리완료","부안읍"
742,"64,555번 시내버스","오산에 거주하는 시민이고요 작년겨울철에 집바로뒤쪽 하천공사한다고 아무런조치없이 공사를시작해서 한파때문에 땅을파해쳐놓고 방치하고 있다가 공사를 올해초에 마무리를  했는데요 빈공간을 흙으로 덮어 놓은상태로 마무리 했습니다  시간이 지나가면서 집안벽이조금씩 공사한 방향쪽으로 기우러지면서 그쪽에있는 수도라인쪽에서 누수까지 생겼습니다 오산면에 찾아가서 집상태를 알리고 공사측과 통화했지만 집주소만 문자로 보내라고하시고 연락이 없었어 어떻게 해야할지몰라 글을올리게 됐습니다 갈수록 무너지는 벽을보며 불안한 마음으로 한숨만 쉬고있습니다 어떻게 해야할지 방법좀 알려주십시요","2018-04-19","2018-04-19","2018-04-25","교통행정과","처리완료","부안읍"
743,"(SPP-1711-3000206)자갈및 불균형 패임 보행시 위험 처리부탁드려요 *","진서면 석포리 일대 태양광발전 개발행위 허가를 막아주세요","2017-11-30",,"2017-12-09","푸른도시과","처리완료","주산면"
744,"★ 김제시민이 안심하고 건강하게 접할수 있는 식품정책..^^","★ 김제시민이 안심하고 건강하게 접할수 있는 식품정책..^^","2017-03-23",,"2017-04-24","보건위생과","처리완료","변산면"
745,"전주한옥마을연계한관광콘텐츠제안","출산정책으로 24개월 미만인 영아의 가정에 종량제 쓰레기봉투 지급 확대","2017-05-31",,,"기획예산과","처리완료","부안읍"
746,"불법주차 감소 방안:시내 주차장 연계한 요금할인 카드 제작","한옥마을 관광상품 제안(인력거)","2017-03-16",,,"기획예산과","처리완료","부안읍"
747,"[생활불편신고]불법 주차","<불법주정차> 횡단보도 불법주차 (1/2) I : 2018.01.15 11:24:14 (2/2) I : 2018.01.15 11:23:04 A :  : I :  .[ (02-2195-1129~30)]","2018-01-15",,"2018-01-22","건설교통과","처리완료","동진면"
748,"무자격 공인중개 및 부동산 시장 교란 행위","금일 아침 아담사거리 소재 편의점을 들르기 위해 차에서 나오던 중 비가 오는 관계로 측방 주시를 소홀히 한 체 전방만을 보고 가는 도중 갑작스럽게 머리와 어깨에 강한 충격을 받았습니다. 확인한 즉 신호등주에 설치되어 있는 용처를 정확히 알 수없는 제어반함이었습니다. 제가 알고 있는바로는 이런 시설물은 사람의 통행에 지장을 주지 않는 범위내에서 설치하여야 한다라고 알고 있는데 이렇듯 낮은 위치에 설치되어 있어 야간이나 금일처럼 궂은 날씨에는 이를 간과하다 사고로 이어질 것이 자명하다 할 것입니다. 현재 아직도 충격으로 인한 두통과 통증이 있으나 크게 염려되지 않아 이에 대한 보상은 운운하지 않을 것이나 추후에 동일한 일이 발생하지 말라는 보장이 없는바 이는 즉각 시정하여 주셨으면 합니다.붙임 : 현장사진","2018-03-11",,"2018-03-20","민원소통과","처리완료","부안읍"
749,"주정차금지구역 주차","주정차금지구역에 주차를해서차들과 사람들지나가기가 불편합니다제네시스 13서 0669","2016-12-26","2016-12-26","2017-01-02","교통행정과","처리완료","계화면"
750,"신호등","부송 영무예다음과 오페라하우스 사이의 도로가 마땅히 선화로 73길과 연결이 되어야 함에도 불구하고 주변 도로 계획없이 사업승인이 나서 곧 입주(2019년2월)를 앞두고 있습니다. 현재도 부송코아루 일대가 교통체증이 심각합니다. 부송초, 부송중 등하교 시간은 물론이고 출퇴근 시간에 교통체증이 매우 심합니다.2018년 2월 부송코아루까지 입주하고나면 교통체증은 더더욱 심해질 것입니다. 모델하우스에서 조감도를 보고 계약한 저로서는 이제와서 도로개통이 안된다는 말을듣고...황당함을 금치 못하고 있습니다.  안그래도 비싼 아파트를 어렵게 구입하게되었는데 일부 정말 작은 도로 개설이 안되어 부송동 일대의 다른 시민들까지 불편을 겪게될일이 불보듯 뻔합니다.  코아루101동 10미터 폭의 도로공사시 함께 진행될수 있도록 하여야합니다.   이렇게 신청한 시행사도  허가해준 익산시도 이해할수가 없습니다. 다른방향쪽도로는 진입과정도 복잡하고 내집들어가는데 이렇게 힘들어서야....초등학교 중학교 학군이 이리좋은 부송동에서...동아아파트 시민들을 위해서라도 꼭 개설되어야합니다....    ","2018-03-26","2018-03-26","2018-03-27","교통행정과","처리완료","하서면"
751,"문의합니다","강아지를 키우는 사람으로써 이번 하트 사건을 보고경악을 금치 못했습니다.10년을 키운 하트를 어떤 마음으로, 어떤 애정으로 돌봐주고 키웠을지느낄수 있었기때문에 이번 사건 결코 가볍게 생각하시면 안됩니다.하트사건의 처벌을 강하게 하여 같은일이 벌어지지 않도록 해주세요.","2016-10-04","2016-10-04","2016-10-06","시정에바란다","처리완료","부안읍"
752,"[안전신고] (SPP-1604-1115053)부안에서 김제 방향 우회전시 도로 포토홀 조치바람","전라북도 부안군 부안읍 동중리 339-23강풍에 의거 가로수와 cctv넘어짐","2016-04-20",,"2016-04-28","건설교통과","처리완료","부안읍"
753,"답변 붙여넣기 하지 마세요.","2016년 12월 19일 15시경 저희 매장에 강현숙 외 1명이 축산업 관련 점검을 나왔습니다.점검 내용으로는 시장 구조상 매장 앞에 있는 냉장 쇼케이스와 그 안에 있는  고기상품을 매장 내로 철수해야 한다고말하며  신고필증에 있는 배치데로 시정 조치하라고 확인서에 서명을 했습니다. 미조치시 벌금을 부과한다고 말하였습니다. 그러나 제가 생각하기에는 강제적이며 반협박 식으로 들렸습니다. 언제까지 꼭 행하라는 말이 너무 불합리하게 느꼈습니다.그런데 왜 서동시장 내 축산물업계만 들어가라고 합니까?여기 서동시장 앞에 있는 앞길이 다 도로이고 나라 땅인데 수산, 과일, 청과, 떡집, 방앗간,의류업,김, 분식 (불법공작물) 다른 업계도 다 나라 땅에서 건물 밖에 노점식으로 장사하고 있는데 어째서 저희 축산물만 조치를 받아야 하는지이해할 수가 없습니다.이에 대한 축산업계를 제외한 다른 업계도 시장 통로에 있는 건물 앞 모든 불법 공작물들을 건물 안으로 다 철거할 수있도록 조치 바랍니다.조치 시 연락이 오기를 바라며 연락이 없을 경우 국민 신문고에 접수 하도록 하겠습니다.이 조치가 반드시 행해질 때까지 억울함에 호소 하겠습니다.(서동시장에 빠른 시일 내 시찰 나오시기 바랍니다.)","2016-12-12","2016-12-12","2016-12-16","축산과","처리완료","부안읍"
754,"자동차 함께 타기 시민 운동","김제시와 (주) 비상교육 간 '다문화 가정 온라인 한국어 교육"""""""" 제휴 제안","2017-11-17",,"2018-01-29","기획감사실","처리완료","부안읍"
755,"제설작업 좀 해주세요","부송동에서 익산시 2공단 으로 넘어가는길(삼례읍방향)제설작업좀 신경써서 해주세요기온이 낮고 눈이 계속 내리다보니 도로가 얼어서아주 위험합니다. 우석대방향으로 자동차통행량이 많고화물차들도 많이 다녀서 위험합니다추운데 시민안전에 신경써주시느라 감사합니다","2018-01-11","2018-01-11","2018-01-13","도로공원과","처리완료","변산면"
756,"박준배 시장님께 김제 성산공원/전망대 활용방안에 대한 제안을 하고자 합니다.","익산시의 답변은 잘 확인했읍니다. 익산시는 과연 익산시민을 위한 기관인지요?시민의 안전을 위한다면 시민들의 건강증진을 위한 생활체육공간인  족구전용구장을 제한하지 말고 대책이 마련될때까지 수원이 연고지인 Kt 야구단을  수원에서 연습하라하세요.여기가 수원시청인가요?","2018-06-22",,"2018-07-03","공원녹지과","처리완료","줄포면"
757,"함열농공단지 치안","금일 오후 7시 30분경 함열농공단지에서 개 목줄을하고 산책하는 중에맹견 5~6마리를 목줄도 안하고 산책시키는 사람을 만났습니다혹시 공격할까봐 일부러 멀찍이 떨어져서 지나치려 했지만 순식간에 개들에게 사방을 둘러싸여 공포에 떨었습니다도망치려 했지만 계속 쫓아와 저의 개를 공격했습니다 개 주인은 멀찍이 떨어져 그만하라고 소리치기만 했고적극적인 대응은 한참후에 했습니다저도 공격받을까 무서움에 떨었습니다 저의 개가 몇차례 물린거 같았는데 피를 흘리는 상처는 없었습니다핸드폰을 소지하고 있지 않아 집으로 돌아와 바로 112로 신고하였는데 주인에 대한 과태료 처분은 익산시청에서 한다고 시청으로 전화를 돌려주었는데시청 직원은 함열농공단지에서 주인이 있는 개가 목줄을 안한 상태라면 경찰서로 신고하라고 하더군요누구 관할이건 그건 제가 판단할 부분은 아닐거 같구요제가 원하는건농공단지 내에 산책하는 주민들이 많습니다 하지만 가로등 하나도 켜놓지 않아 해가 지면 깜깜해집니다물론 공사지역이라 출입이 제한되는건 압니다만지역주민들이 현재 산책로로 이용중인데 출입제한지역이라해서 치안에 소홀해서는 안될거라 생각되네요집 앞이 우범지역이 되는 것이 무섭고 싫습니다순찰을 강화해주시고 내일이라도 당장 동지산마을과 함열여고를 잇는 도로에 가로등을 켜주길 바랍니다그리고 동지산마을과 함열여고를 잇는 도로를 빠른 시일내에 개통해주었으면 좋겠네요몇년째 출퇴근길을 우회하고 있어 너무 불편하네요","2018-09-12","2018-09-12","2018-09-13","축산과","처리완료","부안읍"
758,"2016년 제1회 임실 아삭아삭 김장페스티벌","모현동1가 우림한솔아파트, 현대1차아파트 뒤 도로에 대한 개선을 ,"2016-11-23",,,"군수실","처리완료","순창읍"
759,"익산시는 말도 안되는살아있는 닭.예방차원으로의 살처분중지하시길.","마을진입로 막은 암석처리 요구(이전  24811, 24997와 연관입니다.)1. 이 곳은 마을 진입 도로 입니다. 사유지 도로라 해도 시멘트 포장 도로 이며, 이는 (첨부 사진 1의)마을 도로를 옮기는 조건에서 토지주가 이곳에 도로를 개설하였고 분양한 전원주택단지의 진입로 입니다.2. 더 이상의 불법으로 도로를 막은 행위자에게 피해가 적기를 바라며 신속 처리하여 주실것을 부탁드립니다.* 관련 검색및 이전과 현황사진 첨부합니다.","2017-03-13","2017-03-13","2017-03-17","축산과","처리완료","효자로"
760,"공설 제2운동장 관리‥","안녕하세요. 매교2길에사는 이복자입니다.얼마전 다송교차로 공사로 인하여  말씀드림니다. 저희 마을은 8가구 정도 살고 있습니다.가정마다 1~2대의 차와 아이들 학원차, 택배,교회차, 손님들의 왕래가 있는 엄연한 동네입니다.그런데 이공사를 하면서  함열에서 익산방향으로 고가도로가 생기면서 직진차선과 함라방면으로 내려가는 우회차선이 생겼는데 마을에서 도로 진입을 하려해도 죄측에서 오는 차들이 잘 보이지도 않고 마을로 들어려면 진입구간이  2 미터도 못가서 동네 진입을 합니다. 동네진입을 위해서 깜박이를 켜고 서행을 하게 되면 뒤에서 오는 우회차량은 속력을  줄이지 않고 빵빵댑니다. 그들은 깜박이도 켜지않습니다. 10대중 한두대정도 깜박이를켜고, 지나가는 차량은 대부분 영업용 차들이 많아서 위험합니다.그런데 동네 진입로 표지판도,도로에도 어떤 표시가 없습니다. 동네  주민에 위험함은 안중에도 없으며 예전보다  차들은 속도를 내며 달립니다. 어제는 횡단보도를 건너시던 동네 아주머니께서 교통사고로 돌아가셨습니다. 아이들이 건너다니고 있습니다.부디 신호,과속카메라 그리고 동네 진입로 표지판 좀 꼭~~~~~  설치해 주십시요.","2016-08-11","2016-08-11","2016-08-11","체육진흥과","처리완료","부안읍"
761,"고맙고 친절한 부송동 박은지님","익산의 동물복지농장인 참사랑 농장 닭들에 대한 살처분을 강력히 반대합니다!해당 농장의 닭들은 정식 검사를 통해 AI 음성 판정을 받았음에도 예방적 살처분이라니! 말이 안됩니다!!현재 공장식 축산으로 인해 창궐하고 있는 동물전염병을 예방할 수 있는 유일한 방법인 동물복지 방법으로 농장을 운영하고 있는 농가에게 이러한 처분은 매우 부당하고 이치에 맞지 않습니다.익산시는 살처분 명령을 철회하십시오!","2017-03-07","2017-03-08","2017-03-10","행정지원과","처리완료","부안읍"
762,"쓰레기 불법투기 방지용 cctv설치요청","평화육교 우회도로에 과속방지턱이 5개나 설치되었는데 너무 많고, 규격에 맞지 않습니다. 확인을 부탁드립니다. 돌아가면서 짜증이 나는데, 턱턱턱 방지턱 때문에 더 미치겠습니다. 규격에 맞는 방지턱은 부드럽게 넘어가거든요. 그리고 5개는 너무 많지 않습니까? 한두 개라면 이해를 하겠는데. 빠른 조치를 부탁드립니다.","2018-07-15","2018-07-15","2018-07-18","청소자원과","처리완료","부안읍"
763,"진정서","전라북도 부안에 살고 있는 주민입니다 1월29날 국토교통부에 민원을 보내고 2월2일날 부안구청에 전달이송된다고 연락이 왔지만 부안구청은 아무 소식이 없 습니다 공무원 실수로 하자보수금을 한푼도 받지 않고 허가가 되어 여러가지 하자로 살 수가 없 습니다가장 심한것 계단 벽 타일이 대부분 떨어져 계단 사용 하기가 무섭습니다 업무실수 인정해도 해결할수없다고 합니다죄을 인정 해도 죄값은 받지않고 살겠다고 하는 공무원 무책임한 행동이이해 할수 있나요국토교통부에서 온 문서도 무시하고 있는 부안 군청 많은 문제가 있다고 생각합니다신속한 처리 부탁합니다 새해 복많이 받으세요","2016-03-02",,"2016-03-10","민원소통과","처리완료","보안면"
764,"(SPP-1801-1800141)횡단보도에 주차하는거 아니라고 알고있음 * 첨부파일촬","전라북도 부안군 부안읍 선은리 330-1횡단보도에 주차하는거 아니라고 알고있음*  *(1/3) C: 2018/01/18 11:25:01(2/3) C: 2018/01/18 11:25:15(3/3) C: 2018/01/18 11:25:34G:  *","2018-01-18",,"2018-01-26","건설교통과","처리완료","계화면"
765,"불법형실변경 원상복구 촉구","익산시 평화동 42-29 번지 불법형질 변경 원상복구(토사 반출) 촉구 건입니다.자세한 사항은 첨부 파일을 참조하시기 바랍니다.","2018-07-08","2018-07-08","2018-07-12","도시재생과","처리완료","변산면"
766,"부안군 해양수산과 (공유수면 점.사용허가 신청에 대한 보완서류)","지석마을 태양광 발전시설 결사반대","2017-05-15",,"2017-05-18","해양수산과","처리완료","부안읍"
767,"상서산 등산로길 정비","장수군 홈페이지를 이용하다보면, 부서별 게시판이 있고 관련 공지사항 등에 대한 사항을 담당자가 올리게 되어있습니다.

현재, 제가 장수군에 거주하면서 몇가지 불편했던 사항은 군청 부서별 보조사업(군, 도비)에 대한 내용이 읍면 사무소로 내려가고 그걸 이장님들이 주민들에게 전파하는 형식으로 이장님 방송 혹은, 홈페이지에 게시된 이장회보를 열람하는 방식을 채택하고 있는 것으로 파악하고 있습니다.

더군다나 동일한 사업이 산서면 이장회보에는 게시되어 있고, 장수읍 이장회보에는 게시되지 않아 주민들에게 정보가 전달되지 않은 사례도 있었습니다.

한마디로, 보조사업 등 사업에 대한 정보(지침 등)는 부서별 홈페이지에 공개되지 않은채 읍면사무소로 문의하라는 체계로만 되어 있어 시간상, 거리상 애로사항이 있습니다.

타 시군의 경우, 읍사무소에 어떤 사업모집, 진행에 대한 정보가 내려가고 해당부서에서 이런 사업이며 지침이 이러하니 읽어보고 참고하시라, 그리고 제출하는 서류양식을 올려서 컴퓨터에서 바로 신청서를 작성할 수 있는 구조로 되어 있습니다.

우선 업무의 효율성 면을 보더라도, 어떤사람이 대상이며, 어떤 부분은 제한이 있으며 어느정도까지 어떤것이 지원된다고 하는 업무적인 내용은 문서상 전달이 더 효율적이라 생각하며(실제로 읍면 직원 및 이장님의 관련 사업 이해부족으로 문제가 생긴 사례가 빈번한 것으로 알고 있습니다)

항상 업무과부하에 시달리는 읍면사무소를 비롯한, 군청 직원들의 업무 효율에도 지침이나 정보를 각 과 게시판에 게시하는 것이 효과적이라 생각합니다.

요지: 군청 각과 게시판을 이용, 읍면으로 내려가는 보조사업의 지침이나 정보들을 열람할 수 있게 게시하도록하여 군청의 업무 효율성 증가, 군민의 정보 활용을 도와주셨으면 합니다.

","2017-09-05",,"2017-09-12","대외협력","처리완료","부안읍"
768,"학자금대출이자지원","어양 체육공원 풋살장주차장옆 주택하나잇는곳에서매번 불법소각을 합니다 안그래도 익산 공기도 안좋은데탄냄새 진동하네요좀전에는 소방차도 몇대왓던데..조취좀 취해주세요..ㅠ","2017-08-11","2017-08-11","2017-08-14","교육정보과","처리완료","줄포면"
769,"[생활불편신고]기타 생활불편","전라북도 부안군 상서면 장동리 221불이 안들어와요*  *(1/1) G: 2017/07/07 11:39:19G:*","2017-07-19",,"2017-07-28","건설교통과","처리완료","부안읍"
770,"익산시 위탁 유기견 시보호소...","제목을 사건이라고 쓸만큼 사진을 찍는작태나유기동물들을 넣어온 뜰창이나비인간적이라는 생각이 드네요이게 익산시의 수준입니까?????뒷모가지를 잡고 막대기로 찌르며 사진찍는 행위모두 동물학대로 보입니다보호소 담당자 변경과 보호소 환경 좀 조금만이라도 개선해주세요!!","2016-11-09","2016-11-09","2016-11-10","축산과","처리완료","부안읍"
771,"시민의소리 ????배구 아카데미의건","전라북도 부안군 위도면 진리 1-207도로파임","2016-09-05","2016-09-05","2016-09-12","체육진흥과","처리완료","인후3길"
772,"김제시 볼거리 정보를 카카오스토리 채널로 개인 계정으로 스크랩 공유 서비스 제안","미륵산 연수원 등산로 계단 정비 부탁드립니다~계단목재가 부서진곳이 많더라구요~ 폐타이어완충재때문에 부서진부분이 잘 보이지 않아 부상위험도 크구요~ 그리고 한증막쪽이나 함라산 등산로에는 수도시설이 없어 많이 불편합니다~용화산이나 연수원쪽에는 야외에 수도시설이 있어 편리한점이 한두가지가 아닌데~한증막쪽이나 함라산에는 야외에 수도시설이 없어 몹시 불편합니다~정비및 설치 부탁드립니다!","2016-07-06",,"2016-08-31","문화홍보축제실","처리완료","석정로"
773,"악취!!!!!!","8월에도글남겼었는데전화하셔서원인을알아보겠다고하셔서전화주실줄알았는데답변완료가떠있네요원인을모르고계속잠에서깨고공포스러워서힘이드네요원인을알게되더라도 새벽에펑펑소리너무힘드네요동물을,"2017-09-04","2017-09-04","2017-09-05","녹색환경과","처리완료","부안읍"
774,"폭염에 열대야에 창문도 뭇 열고 악취의 심각성을 알고 있는지?","시정에 고생이 많습니다.모현동 부영1차 아파트와  오투그란데 아파트 사이에많은 돈을 들여 실개천을 만들어 놨는데4계절 모두 물을 흘려 보낼수는 없더손 치더라도여름에라도 물을 흘려 보낼 수 없는지요물이 흐르지 않는다면 차라리 미관상 없는것이낳을 수 있다는 생각 까지 듭니다.관리자들의 관심  부족인지 예산문제인지..관심있게 들여다 보면 이것 저것개선할 점이 너무나 많은것 같습니다","2016-07-27","2016-07-27","2016-08-03","산림공원과","처리완료","부안읍"
775,"[생활불편신고]불법 정차","<불법주정차> 인도불법장기주차  (1/2) A : 2018.08.14 15:17:10 (2/2) A : 2018.08.14 15:17:28 A :  : I :  .[  : 1522-0660 ()]","2018-08-14",,"2018-08-23","건설교통과","처리완료","궁멀길"
776,"육아지원센터 실내놀이터","존경하는 사장님 안녕하십니까?            저는 군산시 수송동  21-16 건물주(까먼헤어) 백종건입니다.        군산시 미장동 경포천  미장교 재가설공사장 안전불감증이 심각합니다.      공사장 가스통은  보관장소가 있으나 밖에 아무렇게 방치되있고        안전시설은 곳곳이  회손되 인명사고가 날까 두럽기만 합니다.        안전총괄과는 뭐하는  부서인지 모르겠습니다          군산시민이 이렇게  민원을 여러 번 민원을 신청했는데 해결은 안되고 공사만    무리하게 진행시키니  답답합니다.            제발 공사좀 중단하고  시민의 안전을 보호해주세요.","2017-01-05","2017-01-05","2017-01-07","박성엽","처리완료","보안면"
777,"불법건축물,익산시는 늦장 대응","땡볕 더위 더 이상 긴 말은 하지 않을 것이다. 평화동에 위치한 한일장여관 불법건축물 이다는 제보가 이어진다.영업용 숙박업소에서 원룸 구조 변경 허가 신청 없이 싱크대를 설치하고,주방수도꼭지 설치까지 불법적인 행태를 벌인다는 것이다. 또한 여관 옆 휴게실까지 사업자 명의가 다른 형태로 영업을 하고 있다는 사실 여부를 밝히고,일벌백계 조치로 다스려라. 익산시 주택과 담당자 전영수 씨는 이를 인지하고,조속히 실행 하라.방관 시 익산시민의 이름으로 묵고하지 않을 것이다.","2017-08-04","2017-08-04","2017-08-10","주택과","처리완료","하나운로"
778,"개인 택시와 음식점 단합 고발합니다.","군산시 신금길 28, 30 번지에 있는 두 과일가게 이야기 입니다.상호가 <해뜨는 청과><원협직판장 33번> 이라고 간판이 붙어있습니다.매일 출퇴근길에 그곳을 지나가는데 몇 년째 차도를 점유하며 과일장사를 하고 있습니다.자기 가게가 엄연히 있는데도 가게 안에는 비어놓고 인도와 차도를 침범하는 불법을 저지르고 있습니다.그간 수없이 많은 경찰이나 시청 공무원들도 지나 다녔을텐데 누군가는 신고해서 조치를 취하겠지...한게 벌써 몇년째 지났습니다.이제나 저제나 해소될까 해도 무슨 베짱인지...상인회는 뭐하는 사람들인지...특히나 명절때는 아예 편도 절반을 넘게 과일을 깔아놓고 그것을 사려는 사람들 때문에 아예 차도가 없을 지경입니다.그곳을 지날때 차도 중앙까지 침범한 과일판매 때문에 중앙선을 넘어서 통과할 수 밖에 없는데 주차장에서 나오는 차량도 많고 반대쪽에서 오는 차량들한테도 많은 위협이 되고 있습니다.꼭 사고가 나야 해결 될 것인지요?모든 사고는 제반 규정을 지키지 않을때 나는것입니다.지금 당장이라도 한번 나가서 보세요.불법도로점유로 과태료를 물려서라도 꼭 시정을 해 주시기 바랍니다.","2017-11-18","2017-11-18","2017-11-29","직소민원팀","처리완료","부안읍"
