"순번","민원제목","민원내용","민원등록일","민원수정일","민원답변일","처리부서","진행상태","민원인주소_법정동"
1,"어양동 김제형내과 근처 신고","어양동 일대 첨부파일1의 내용과 같이 현수막 신고합니다.1, 어양동 하나로 와 부송1로 교차로(어양공원) 현수막 신고2, 어양동 무왕로22길 어양우미아파트 정문 입구 근처 현수막 신고3, 어양동 하나로 어양공원 근처 현수막 신고.철거전. 철거후 사진 첨부 바랍니다.","2017-05-28","2017-05-28","2017-06-05","도로공원과","처리완료","부안읍"
2,"할랄단지!! 절대반대","할랄 식품단지 설립을 반대합니다.할랄식품단지 조성으로 인하여 우리가 잃게 될 엄청난 사실들(이슬람 문화의 정착으로 인하여 벌어질 많은 일들)을알면서 그것을  보고만 있는다면 그건 대한민국 국민이 아니라고 생각합니다.부디 자라는 우리의 미래세대를 생각해서라도 이런 일들은 정말 충분히 고려하고 또 고려하여  우리 선조들이지켜오신 아름다운 문화를 훼손하는 일이 없도록, 우리 아이들에게 부끄럽지않은 엄마.아빠로 남겨질 수 있도록선처바랍니다.  지금 세계가 주목하고 있는 IS를 보면서 어떻게 이런일들을 계획하고 승인할 수 있는지요.익산뿐만이 아닌 우리나라의 미래가 어떻게 되어지길 원하나요?  결코 있을 수 없는 일들이 이땅에서 자꾸 벌어지고 있습니다. 할랄식품단지 조성은 절대 안됩니다. ","2016-01-07","2016-01-07","2016-01-07","식품클러스터지원과","처리완료","부안읍"
3,"가로등 불이 들어오지 않습니다","전라북도 부안군 변산면 마포리 산 12-3깜깜해요*  *(1/1) G: 2018/03/16 17:04:09G:  *","2018-03-20",,"2018-03-29","부안읍","처리완료","부안읍"
4,"(SPP-1703-2900280)화장실 문 파손되어서 문이 없음","전라북도 부안군 동진면 봉황리 382-3물길을 위해 파 놓은것 같은데차나 사람이 지나갈 시 턱이 좀 있어요","2017-03-29",,"2017-03-31","해양수산과","처리완료","부안읍"
5,"참사랑 농장 살처분 하지 마십시요!!","안녕하세요익산 시청장님말도 안되는일이 벌어지고 있어 이렇게  익산시청에 글을 올립니다AI 감염이 된 닭들은 살처분 대상이죠그런데 AI 감염여부가 음성으로 나왔는데도 불구하고왜 살처분하시려는 겁니까?납득이 되지 않습니다.참사랑 농장의 경우엔 다른사육장과 달리  닭 사육을 특별하게 관리해와서면역력이 좋기로 소문나있고,감염여부도 음성판정이나왔는데도 불구하고 살처분한다는게 말입니까?요즘 안그래도 살기 힘든 마당에 도와주지 못할망정왜 말도안돼는 일을 하시는지 모르겠습니다이건 누가봐도 불법 살처분입니다국민이 뭘 원하는지 익산 시민이 무엇을 원하는지 두눈을 크게 뜨고귀를 귀울여 들어주세요제발 부탁드립니다...  ","2017-03-13","2017-03-13","2017-03-17","축산과","처리완료","변산면"
6,"신호등설치해주세요","접수일시: 2018년 08월22일/ 제출처: 부안군청 건설과 행정팀미불용지 대상토지: 부안읍 서외리 42-77 (83평방미터)대상토지에 대해서 미불용지 보상신청서(매입청구서)를제출했습니다.신청한 토지가 미불용지로서 보상청구(매입청구)대상이면회신 해주시기바람니다.혹, 미불용지가 아니라서 보상청구대상이 아니면 사유(내역)회신 부탁합니다.(보상예정금액이나,보상예정지급시기에대한 회신이 아님니다.) 미불용지 유,무와 매입청구 유,무에 대해서 회신부탁합니다.","2018-01-31","2018-01-31","2018-02-01","교통행정과","처리완료","무삼지4길"
7,"버스가 그냥 지나감","안녕하세요. 저는 평소 자가용으로 출퇴근을 하는 직장인입니다.하지만 운전을 시작한지 그리 오래 되지 않았고, 어젯밤 내린 눈으로 도로가 얼었기에 오늘은 대중교통을 이용하여 출근을 하기로 하였습니다. 시내버스 이용을 자주 하지 않다보니 정확한 노선을 알지 못하여, 탑승 전에 버스 운전기사분께 목적지(동익산 정류장)까지 가는지 몇 번이고 되물어봤습니다. 기사님께서 목적지까지 가는게 맞다고 확인을 해주신 끝에 저는 2017년 12월 12일 오늘 오전 7시 30분경 부송동 주공8,9차 앞 버스정류장에서 107-2번 버스를 탔습니다.그런데 버스에 탑승한 뒤 30분 이상 지나고 익산역 앞을 지나 중앙사거리 방향으로 좌회전을 하자마자 버스 운전기사님께서 """"""""동익산 가신다는 손님~!""""""""하고 부르시길래 대답을 했더니,생각해보니 이 버스는 동익산역까지 운행하지 않는다는 겁니다. 그래서 저는 """"""""타기 전에 목적지까지 가신다고 말씀하지 않으셨냐""""""""고 되물었고, 기사님께서는 미안하다는 한마디 말도 없이 `본인도 노선이 헷갈려서 그랬다`고 말씀하시며 지금 내리라고 하시는 겁니다. 당황한 저는 일단 버스에서 내렸습니다. 아침인데다 도로상황 좋지 않다보니 어렵게 택시를 타고 출근은 했지만, 생각할수록 황당해서 태어나 처음으로 민원을 제기합니다.버스 운전을 하시는 기사님들께서는 여러 버스를 돌아가며 운전을 하다보니, 노선이 헷갈릴수도 있습니다. 하지만 분명 타기 전에 2번이나 확인을 했었기에 믿었는데, 너무나 태연하게 헷갈렸다는 한 마디로 무마시키시다니...기분이 좋지 않네요.저는 그 기사분께 사과를 요구하는 것이 아닙니다. 제가 시내버스를 이용하지 않으면 될 일이기에... 제가 부탁드리고 싶은 것은 아래와 같습니다.1. 익산시청 홈페이지에 등재된 버스 노선표를 찾아보니, 107번과 107-1, 107-2번 모두 경유지에 """"""""동익산""""""""이 표기 되어 있고, 노선표에도 동익산을 지나가는 것으로 명시되어 있습니다. 이는 실제 운행노선과 다르므로 즉각 수정 부탁드립니다. 제가 버스 탑승 전 시청에 등재된 노선표를 확인했다하더라도 오늘과 같은 일이 벌어졌을 것입니다.2. 최소한 본인이 운행하는 버스 노선은 확실히 인지하도록 교육이 필요할 것 같습니다. (ex.운행 노선표 지참)3. 버스운행이 힘든 일이라는 것은 알겠으나, 어쨌든 서비스업이기에 승객들에게 더 나은 응대를 해주시면 감사하겠습니다. ","2017-11-19","2017-11-19","2017-11-24","교통행정과","처리완료","부안읍"
8,"가습기살균제 옥시물품을 사용하지 맙시다.","1. 시정운영에 항상 힘써주셔서 대단히 감사합니다.2. 군장대학교에서 시내방면으로 나가는 버스를 야간에 대기하면서 버스정류장에 전등이 없어서 야간에 안전사고 우려 및 대중교통 이용자가 버스를 대기하면서 두려움이 있는듯 합니다.3. 하지만 군장대 정류장은 이용자가 적어 지속적으로 전등을 켜둘시 에너지 낭비가 예상 됩니다만, 태양광전지판을 이용한 센서등을 설치하면 어느정도 에너지 절약 효과가 예상이 됩니다.4. 3번사항이 어렵더라면 센서등 정도의 전등을 설치 하여 야간에 시내버스를 이용하는 승객들이 보다 안전하게 버스를 이용하게 해 주시면 감사하겠습니다. 끝.","2016-05-17","2016-05-17","2016-05-18","농산물유통과","처리완료","부안읍"
9,"맹동마을 산업도로 옆 경작지 피해","전북 익산시의 송학동과 오산면 일원 `이리변전소 송전선로` 3개선의 지중화사업이 이달 준공된다.시는 130억원의 사업비를 투입해 이리변전소 주변 2.4㎞ 구간의 송전선로 지중화를 지난해 말 완료했으며, 송전탑 11기에 대한 철거작업 공사가 이달중 마무리된다고 25일 밝혔다.시는 지중화공사와 병행 추진 중에 있는 망기마을 진입도로공사가 상반기 중 완료될 경우 변전소 일대의 도시미관과 대상지역 주민의 생활환경이 획기적으로 개선되는 효과가 있을 것으로 보고 있다.익산에 영등중학교 어양중학교 인근 변전소와 송전탑 지중화가 제일 먼저 아닌가요?학생들과 동도미소드림 리젠시빌 어양라온프라이빗 아파트 입주민들한테도 그렇고요..이곳 송전탑부터 지중화 시켜야 된다고 생각합니다.아이들의 건강을 생각해서라도요.이곳도 지중화해주세요","2017-06-05","2017-06-05","2017-06-14","경영개발과","처리완료","부안읍"
10,"제발 부탁드립니다","<> 후미등 불법 튜닝으로 식별의 어려움 (1/1) I : 2018.09.24 17:30:58 A :  : I :  .[  : 1522-0660 ()]","2016-07-06","2016-07-06","2016-11-24","교통행정과","처리완료","사창길"
11,"도시가스관 및 상수도","안녕하세요.익산시 석암동 주민입니다도시가스관이 동네 입구를 지나갑니다만동네인쪽까지는 설치가 안되있어서많은 비용을 부담해서 설치가 어렵습니다시에서 도시가스와 상수도 설치에관해 지원부탁드립다","2017-02-05","2017-02-05","2017-02-07","상수도과","처리완료","변산면"
12,"익산동물보호소 시정조치 답글을,"관리를 어떻게 하고 계시길래, 작고 불쌍한 아이들을 저렇게 대하는 거죠?공고사진이 저리 혐오스러울 정도면, 대체 평소에는 잡아죽일 기세네요?당장 시정처리하세요!!","2016-12-08","2016-12-08","2016-12-09","축산과","처리완료","부안읍"
13,"익산시 북부청사 이전에 대하여","안녕하십니까 익산시 조직개편안이 작년 연말에 익산시의회를 통과하였고익산시 조직개편에 따른 인사발령이 2017년1월20일(1월23일 시행) 났고그에 따른 부서들이 익산시 북부청사에 입주를 했는데도안내하는 기능이 미비한것 같습니다 익산시민의 눈으로 익산시 북부청사를 보면서 몇글자 적은것입니다하루라도 빨리 시행되기를 바랍니다 자세한 사항은 첨부자료로 대신합니다 감사합니다","2017-02-02","2017-02-02","2017-02-07","미래농업과","처리완료","변산면"
14,"도로변제초작업부서담당자연락바람","시민의 주거생활 향상에 노력해 주시는 시장님께 감사드립니다...다름이 아니오라....시에서 발송하는 공문의 자료제출에 대한 말씀입니다.오늘 오전(9월 14일) 주택행정과에서 팩스로 발송된 공문입니다. 당일 발송하시고 당일 제출하라니.......주택행정과에 전화해서 """"""""소장님이 교육가셔서 직인이 없어 공문발송이 안되니 내일 제출하면 안될까요?????"""""""" 했더니 """"""""시에서 발송한 공문에 직접 써서 팩스로 전송하시고, 낼 다시 공문작성하여 제출하세요....우리가 소장님이 교육을 가셨는지까지 확인을 해야합니까???? 하시면서 화을 내시더군요....그럼 우리는 두번 일을 해야합니까?????그래서 제가""""""""공문을 보내실때 자료 제출 할수 있는 기간은 2-3일은 줘야 되는거 아닙니까??"""""""" 했더니그 공무원께서 """"""""선생님 그럼 제출하지 마세요...."""""""" 하시면서 화를 내더군요 그럼 우리는 두번 일을 해야합니까????","2017-11-17","2017-11-17",,"임피면","처리중","부안읍"
15,"우리마을길 정비","황등에 20년이더 지난 5층아파트인 진성아파트에 5층에 10년넘게 살고있는데요처음부터 수압은 약했습니다. 얼마전 다른층에 건물에 수압이낮아서 수압펌프를 설치한뒤에는물이 너무 약하게 나오네요.. 밤늦게 펌프소리 소음도 있고..씻을때도 오래걸리고.. 노후수도관 교체에 황등은 없는건가요?아니면 20년넘은 노후수도관 교체지역없이 바꿔주는 사업인가요?수압문제를 해결해야하는데 어떻게 해야할까요?수압펌프를 개인적으로 설치하는 방법은 알지만.. 다른집에 수압이 더 낮아지며, 소음문제가 있어서그건 좀.. 않아고 싶거든요","2016-07-04","2016-07-04","2016-07-13","도로관리과","처리완료","부안읍"
16,"화단 공사 및 영업관련","앱으로 불법광고물 신고를 7일날 했는데 아직도 처리중으로 떠있네요  그앱이 혹시 익산시청해당부서 와 연결되지않은건가요??? 플랑카드가  차 다닐때 펄럭거려서 7일날 신고했는데 아직까지 안띄어져있네요!!익산시청에서는 앱 처리부서가 없는건가요????","2017-10-31","2017-10-31","2017-11-03","도로공원과","처리완료","보안면"
17,"골목길에 휀스 설치 불편","전라북도 부안군 변산면 격포리 794격포항등대 난간대 파손 추락위험","2018-09-05",,"2018-09-13","건설교통과","처리완료","가리내로"
18,"39번 시내버스 운전상태","아침마다 버스로 출퇴근하는 사람입니다.요즈음같은 날씨엔 안전운전이 필수인데요특히 시민의 안전을 책임지는 버스야말로 더더욱 신경을 써야한다고 생각합니다.그런데 오늘 아침 39번 버스(번호판 1264)는운행상태가 아주 위협적이더군요눈이와서 도로상태가 안좋은 상태인데도 운전이 좀 거칠길래영 기분이 좋진않은 상태로 목적지에 가기위해 탑승해있는 상태였는데운행도중 어떤차와 작은 시비가 있었습니다.그 운전자의 실수로 사고위험이 있었으나 다행이 사고는 나지 않은상태였습니다.그런데 버스운전자가 그차를 막 뒤따라 가면서 경적을 계속 울려대고신호대기로 정차했을때는 그차 옆에 대고 막 언성을 높여대더군요뒤에 승객들도 타고있는데....허나 그 후가 더 가관이었습니다.버스운전자는 화가 안풀렸는지 계속 거친 운전솜씨를 폼내더군요정류장 정차할때마다 급정거에 급출발에...운행중엔 혼자 성질내고...목적지에 다와서 저는 내렸습니다만정류장을 떠나는 버스를 다시한번보면서 참 많은 생각이 들더군요.버스는 개인차량이 아닙니다.버스기사 한분의 실수로 죄없는 많은 승객들이 다칠수있다는것을좀 유념하고 운행하셨으면 하는 바램입니다.","2018-01-10","2018-01-10","2018-01-12","교통행정과","처리완료","백산면"
19,"방역 방충","추운 날씨에 수고 많습니다다름이 아니라 배산체육공원에서 현영동 가는 고가도로 밑 주정차 차량때문에 글을 올립니다물론 생계를 위해 고생하시는 화물트럭 운전자 분들은 이해하지만원대쪽에서 모현동쪽으로 내려오는 차량수가 적지않습니다그런데 주정차되어잇는 대형 화물차 때문에 현영동으로 직진하는 차는원대쪽에서 모현동으로 내려오는 차가 잘보이질 않습니다특히 신호가 점멸되잇는 새벽시간에는 더욱더 그렇구요사전에 위험요소를 방지하여야 생각되기에 몇자 적어 올립니다수고하세요","2017-10-02","2017-10-02","2017-10-13","도로공원과","처리완료","진서면"
20,"철도송학건널목 도로 포장이라도 좀 해주세요","대학로 빽다방 근처에서 커피를 사가던도중 우회전을 하려던중에 불법주정차 때문에 지나가지 못하고 돌아갔네요 생각없이 주차를 하여서 다른사람들 까지 피해를 보니깐 신고 합니다.","2018-09-21","2018-09-21","2018-09-28","도로공원과","처리완료","부안읍"
21,"(SPP-1807-2500554)하수구 멘홀뚜껑이 노후화되어서 주민들이 운동다니는데 많","전라북도 부안군 부안읍 동중리 122-9가로등 전선 노출 위험*  *(1/4) G: 2018/07/14 07:44:21(2/4) G: 2018/07/14 07:42:27(3/4) G: 2018/07/14 07:42:20(4/4) G: 2018/07/14 07:41:31G:  *","2018-07-25",,"2018-07-30","계화면","처리완료","부안읍"
22,"(SPP-1711-3000203)알림선 파손 및 지워짐 처리부탁드려요 * 첨부파일촬영","<장애인 전용주차구역 불법주차> 불법주차 [  : 새만금홍보관 주차장 ] http://www.gmap.go.kr/portalap/lur/downloadFile.do?dscfNtNo=0000003290208  ※  : 2017.10.03 14:19:14(앨범에서 첨부)[ (02-2195-1129~30)]","2017-11-30",,"2017-12-01","건설교통과","처리완료","줄포면"
23,"(SPP-1703-2300119)나무가 쓰러질것 같아요.",": 전라북도 부안군 변산면 격포리 506미점등 상태이며 위치를 현재위치에서 왼쪽으로 90도 정도만 틀어주시기를 부탁드립니다.[처리요청기관]:부안군","2017-03-23",,"2017-04-04","부안읍","처리완료","부안읍"
24,"지금 모두가 익산시를 주시하고 있습니다","불법주차 관련하여 글을 씁니다.익산 마동 선화1로 도로가 양방향의 불법주차 관련입니다.(전북대오거리 &harr; 삼성주유소 사거리 양방향)낮에는 홍익이란 간판회사의 직원들 차량주차로 양방향 2차로에 불법주차를 하고밤에는 화물차,버스등 대형차량들이 양방향으로 불법주차를 하고 있는데양방향으로 2차로 운행시 불법주차로 1차로 진입시 사고유발이 되고 있습니다.낮이고 밤이고 이들 불법주차로 사고위험이 빈번하게 노출되고 있습니다. 낮,밤 가리지 말고 불법주차 단속하였으면 합니다.","2016-10-08","2016-10-08","2016-10-12","축산과","처리완료","부안읍"
25,"[생활불편신고]불법 주차","전라북도 부안군 부안읍 선은리 55가로등점멸*  *(1/1) C: 2017/11/15 23:27:02G:*","2017-11-19",,"2017-11-29","건설교통과","처리완료","부안읍"
26,"익산유기견보호소","익산시 보호소 입양공고 사진을 보고 반려견을 키우는 사람으로서 경악을 감출수가 없습니다.누가봐도 학대사진으로 밖에 보여지지않습니다.이사진을 보고 잃어버린 가족을 찾겠다고 입양공고 사진을 보는 가족들은 얼마나 끔찍하겠습니까?동물도 생명입니다.살아숨쉬는 생명입니다.생명을 함부로 할 권리는 어느누구에게도 없습니다.유기되고 잃어버리고 말 못하는 동물들일지라도 존중해주십시요.제발 부탁드립니다.입양공고사진 제대로 올려주세요.","2016-11-09","2016-11-09","2016-11-10","축산과","처리완료","부안읍"
27,"전북 익산 유기동물보호소 유기동물학대","전북 익산 유기 동물 보호소에서 유기된 동물들을 쇠파이프로 폭행하고 살가죽을 쥐어뜯으며 구멍이 큰 철창에 아주 작은 강아지를 넣어 옴짝달싹 못하게 하는 등 학대를 자행하고 있습니다. 학대를 자행하는 남성 직원을 모두 해고하고 유기 동물을 정말로 보호하고 주인 품으로 돌려보낼, 새 주인을 찾아줄 진심어린 여성 직원분들을 고용해주세요.수당을 받기 위해 될 수 있는 한 아이들을 많이 잡아다가 학대해서 죽인 후 자연사라고 거짓으로 보고한다고 합니다.  그 사회의 수준을 보려면 동물과 약자를 대하는 태도를 보라고 하는데요. 자신보다 약한 생명을 학대하고 죽이면서도 일말의 죄책감도 없는 저들이 살인자와 다를 것이 무엇입니까? 조치를 강하게 취해주세요 저들을 해고해주세요 벌금형이나 단순 경고로는 절대로 해결되지 않는 문제입니다 해고해서 아예 유기견보호소 일을 하지 못하게 해주세요","2016-11-09","2016-11-09","2016-11-10","축산과","처리완료","백산면"
28,"(SPP-1612-1300103)골목길에 쇼파가 잇습니다.누가 안쓰는것같습니다","신고번호 1AA-1610-187627수고하십니다.본 첨부화일 용량부족으로 추가드리오니 참고하셔요늘 건강하시고 행복하셔요","2016-12-13",,"2016-12-16","부안읍","처리완료","보안면"
29,"고양이밥주는행위","어양동 동서로63길 익산 로컬푸드 직매장 앞 함지박 근처인도에 불법으로 설치된 불법광고물을옥외광고물 법으로 신고합니다.","2016-02-28","2016-02-28",,,"처리완료","부안읍"
30,"시내버스 관련 문의","사람이.미개해도 어찌.이리.미개할수가 있는가 개가.살아있을.당시 주인이 마을회관에 갔더니 모른다고 없다고 잡아때고 그후에 잡아먹어?인간이기를 포기했네 익산시.축산과 이번일 잠재우려고 대충 수습하려다가 큰일.치룹니다 죄값 받게.축산과도 제대로 일하세요 제친구도 다른지방.축산과에서 일하는데 강아지 학대 또는 이렇게 잡아먹일거 같아서 전화로 신고하는.사람이.많고 이렇게 민원 들어오면 시청에서 전후사실.관계 확인을 위해 시청 축산과.직원이 조사나갑니다 그후에 민원인에게 결과.통보해주구요  이사건도 여초남초 할거 ,"2016-07-26","2016-07-26","2016-07-26","교통행정과","처리완료","행안면"
31,"시외버스터미널","전라북도 익산시 선화로3길 31-13 금송빌딩 1층  앞에 오후쯤 되면 신호등 앞에서 장사하는 노점상 때문에 우회전 하는데 상당히 불안 불안 합니다단속해 주시기 바랍니다 자주 가는 곳인데 노점상 때문에 너무 불쾌 하였습니다","2016-05-12","2016-05-12","2016-05-13","교통행정과","처리완료","하서면"
32,"(SPP-1803-0300190)신호등이 고장나서 초록불이 몇초남았는지 모르겠어요 *","전라북도 부안군 상서면 가오리 1037승강장 옆 가로등이 안들어옵니다.밤에 위험하니 고쳐주세요*  *(1/1) C: 2018/02/28 18:21:51G:  *","2018-03-03",,"2018-03-05","건설교통과","처리완료","부안읍"
33,"불법간판신고","다른 지역의 도시는 환경보호와 교통체증을 해결로 자동차 요일제를 시행하고 있습니다. 자동차 요일제에 등록한 차량은  자동차세 감면과 공용주차장 할인등 여러가지 혜택을 주면서 시행하고 있는데 익산시는 그런 좋은 제도를 왜 도입하지 않는지 궁금하네요. 빨리 도입해서 원하는 시민들에게 많은 혜택을 주셨으면 합니다.자동차 공해도 방지하고 신청한 시민은 여러가지 혜택도 받고 좋은 제도 인데 이런 제도를 생각도 안하고 있다는 자체가 너무 합니다","2016-03-18","2016-03-18","2016-03-25","도로관리과","처리완료","부안읍"
34,"(안전보안관)(SPP-1806-2500415)횡단보도 불법 주정차 처벌해주세요 * 첨부파일촬영시간","전라북도 부안군 부안읍 동중리 131-4횡단보도 불법 주정차 처벌해주세요*  *(1/2) C: 2018/06/25 16:24:56(2/2) C: 2018/06/25 16:25:23G:  *","2018-06-25",,"2018-07-03","건설교통과","처리완료","금산면"
35,"(SPP-1804-2200098)어린이 놀이터 계단 망실 * 첨부파일촬영시간 안내(안","전라북도 부안군 부안읍 봉덕리 621-4인도위 물건들 치우게 해주세요*  *(1/1) G: 2018/03/13 20:06:31G:  *","2018-04-22",,"2018-04-24","새만금국제협력과","처리완료","부안읍"
36,"(SPP-1711-1600102)가로등불꺼짐 * 첨부파일촬영시간 안내(안전신문고 운영","전라북도 부안군 부안읍 선은리 403-1가로등점멸*  *(1/1) C: 2017/11/15 23:08:44G:*","2017-11-16",,"2017-11-24","부안읍","처리완료","부안읍"
37,"CCTV 설치해주세요","시의 발전에 수고하시는 시장님께 감사 드립니다. 군산의 3대 큰 행사는 1.군산야행 2.군산시간여행축제 3.진포예술제로 알고 있습니다.군산야행은 군산 역사문화재를 기반으로하는 행사, 시간여행축제는 군산 역사시간을 바탕으로하는 행사, 군산진포예술제는 군산 문화예술인들이 주체가 되어 시민(관광객 포함)을 위한 행사로 알고 있습니다.   실제로 줄을 잘 서라고 하는것 같은데 이렇게 해 가지고는 발전이 없어 제안 드립니다. 술접대는 되고 이런것은 안되는지 궁금 합니다.군산 시민 모두가 공정하고 공평하게 대접 받는 시의 행정을 구현해 주시기 바랍니다.시장님 화이팅 !       (저는 정치인이 아님니다 그리고 어떤 선거에도 출마한 적이 없습니다. 다만 시민으로서 활발한 활동에 많은 제약을 받아 글을 올리는것 입니다.) ","2018-09-27","2018-09-27",,,"처리중","부안읍"
38,"가로등 교체 (led등으로)","1. 본인 청구인 이영애는 2018년 2월 27일 부안군청에 유한회사 씨앤푸드에 대한 정보공개 청구를 한바 있읍니다.2. 다음날 2월 28일 답변 내용에 행정관청에 설립신고를 하지 않아 정보 부존재 통보만을 받은바 있읍니다. 3. 농업회사 법인으로 설립등기에 유한회사 씨엔푸드가 부동산 임대업이 사업종목에 들어있는데 국가적, 사회적 물의를 일으키는 부동산 임대,매매업이 적법한지?처분은 가능한지?4. 유한회사 씨엔푸드 구성인중 농업인이 되어 있는지 구체적 위법사안을 행정관리 처리 진행사항을 알고 싶습니다.5. 유한회사 씨엔푸드 부적격 농업회사 법인으로 신고 하오니 민원처리 해주시면 감사하겠읍니다","2018-03-30",,"2018-04-09","동진면","처리완료","부안읍"
