"순번","민원제목","민원내용","민원등록일","민원수정일","민원답변일","처리부서","진행상태","민원인주소_법정동"
475,"도로 점유","2018년 4월, 부안군 하청로 인근에 발생하는 악취 문제로 민원을 넣었고, 다음과 같은 답변을 받았습니다.---------------------------------------국민신문고로 제기해주신 악취 관련 민원에 답변 드립니다. 현재 백산면 하청리 소재의 부숙토 생산업체는 반복 및 다수민원으로 중점관리 사업장인 바 악취저감을 위한 다음과 같은 조치를 취하고 있음을 알려드립니다. 1. 악취검사 실시 -> 배출허용기준 초과 시 행정처분(개선명령) 조치 2. 악취저감시설 설치 -> 세정탑 세정수 교체시기 단축, 죽초액 분사시설 및 간이세정시설(8기) 설치 -> 원료 반입 및 적재장소 밀폐, 자동문 설치 3. 사업장 주변 청결관리 철저 악취 감소를 위해 지속적으로 관리하고 피해가 없도록 철저히 관리토록 하겠습니다. 끝.------------------------------------------그런데 여전히 악취 문제가 조금도 개선되고 있지 않아 다시 민원 신청합니다.해당지역은 낮에는 아무런 악취 없이 괜찮다가도, 해가 지고 8시 전후가 되면 인근 지역에 악취가 진동을 하기 시작합니다. 이는 해당 업체의 상당히 고의적이고 악의적인 행동이라고 밖에 판단할 수 없는 패턴입니다.인근 마을은 무더운 여름철임에도 불구하고, 이 악취로 인해 창문조차 열어 놓을 수 없습니다. 창문을 열면 악취가 온 집안에 배어들어 도저히 견딜 수가 없고, 창문을 닫아 놓자니 찜통같은 더위를 견뎌야 하는 상황입니다. 이렇게 주민들은 해당 악취로 인해 생활에 큰 고통을 받고 있습니다.지난번 신청한 민원의 답변에서, 담당자께서는 해당 업체에 반복적이고 지속적인 민원이 있었고, 때문에 이 업체가 중점관리 사업장이라고 밝히셨습니다. 하지만 그럼에도 불구하고 이렇게 아무런 개선사항 없이 악취가 지속적으로 발생하는 것은 상당히 의아한 일이 아닐 수 없습니다. 부디 관리감독의 책임을 지고, 성실하고 적극적인 해결방안을 모색해 주시길 요청드립니다.","2018-07-18",,"2018-07-26","건설교통과","처리완료","부안읍"
476,"야미도 유람선 시간지연관련","존경하는 시장님군산시에서 세계적인 행사를 유치하는등 국제무대에 우뚝 설수 있게 된데는 시장님의 노력없이는 불가능 하였을 거라 생각하고 항상 감사하게 생각하고 있습니다 저는 군산시 문화동 군산상고 부근에 살고있는 시민입니다다름이 아니오라 군산시에 제안할 사항이 있어 바쁘신 시장님께 글을 올리게 되었습니다.수년전에 군산상고 정문을 이전하면서 학교진입로를 편도1차로에서 2차로로 확장하게 되었습니다. 이와 관련하여 문화동  785-8번지에 있던 주택을 군산시에서 매입하여 절반정도는 도로부지로 편입되었고 절반정도는 빈공터로 남게 되었습니다.당시 시청 담당공무원에게 빈 공터로 남아있는 곳을 깨끗하게 포장하여 인근 주민들이 주차를 할수있게 해주면 어떻겠냐고 제안을 했더니 나중에 시에서 어떻게 사용할지 모르기 때문에 포장을 할 수가 없다는 답변이었습니다.그런데 수년이 지난 지금까지도 다른 이용계획이 없어서인지 그곳이 쓰레기 장으로 변해버렸습니다. 비록 큰 대로변은 아니지만 군산상고등 여러개의 학교가 위치하고 있어 하루에도 수백명의 학생들과 시민들이 오가는 곳이기도 합니다. 더욱이 개인소유도 아닌 시청 땅에 쓰레기 더미가 나딩구는 것보다는 차라리 깨끗이 포장하여 인근 주민들이 이용할수 있으면 얼마나 좋을까 하는 생각입니다.군산시의 슬로건이 살고싶고 다시오고싶은 군산 아닌가요비록 큰길가는 아니지만 그래도 학교를 찾아오는 외지인과 유동인구가 많은 곳인만큼 시장님께서 꼭한번 살펴 주시면 정말 감사하겠습니다.아침저녁으로 온도차가 큰 환절기입니다. 건강 잘챙기셔서 끝까지 군산의 자랑으로 남아주시길 간절히 기도 하겠습니다.첨부:현장사진5부","2017-09-30","2017-09-30","2017-10-11","관광진흥과","처리완료","부안읍"
477,"청소년수련관 주차방해  신고","어양동 익산시청소년수련관 내 장애인전용주차구역주차방해 차량(13러 50**)을 신고합니다.","2016-11-07","2016-11-07","2016-11-07","경로장애인과","처리완료","변산면"
478,"전주 한옥마을","한옥마을 차없는거리 확대운영","2017-01-31",,,"기획예산과","처리완료","계화면"
479,"농민가공사업","배산제일2차 아파트에서 고현초등학교를 올라가는데에잡초가 굉장히 무성히 자라 있습니다.안전 가드가 굉장히 좁게 세워져 있는 상황에,잡초까지 무성하게 자라서 아이들이 안전 가드 밖 차도로 길을 다닙니다.요즘 살인 진드기 때문에 수풀 근처엔 가지 말라고 기사로도 나오는데,아이들이 통학시 발생할 수 있는 사고를 방지하기 위해 제초 작업을 해주셨으면 합니다. 하신다면 구체적으로 언제쯤 하실 예정인지까지 답변해주세요.","2018-06-22","2018-06-22","2018-06-25","위생과","처리완료","보안면"
480,"매창공원운동기구에 다침","전라북도 부안군 백산면 하청리 300-1반사경 방향 조정 요청*  *(1/1) G: 2017/06/22 13:06:52G:*","2017-07-10",,"2017-07-18","푸른도시과","처리완료","부안읍"
481,"(SPP-1703-2300343)가로등 불이안들어와요","전라북도 부안군 행안면 삼간리 359-2폐기물좀 치워주세요","2017-03-23",,"2017-03-30","부안읍","처리완료","부안읍"
482,"도로 보수 요청","전라북도 부안군 부안읍 봉덕리 669-14인도가 함몰되어 학생들이 위험합니다 보수부탁드립니다*  *(1/1) C: 2018/07/10 09:54:32G:  *","2018-07-13",,"2018-07-24","건설교통과","처리완료","부안읍"
483,"미륵산 자전거길 정비 좀~~","안녕하세요20160923 오후3시경매일시장 주차장을 이용했습니다입구에 주차장표시도 없고 들어갈 땐 시장근처 골목으로 가는줄 알았고, 제가 주차장을 이용한건지는, 시장을 이용한 뒤에 알았습니다. 입구쪽에 들어갈 때 `어이~`라는 소리를 들었으나 저에게 한 말인지 전혀 몰랐고,물건을 구매한 뒤에 나가려고보니 주차담당하시는 분이 무조건 돈내야한다고 하더군요.(천원)주차권도 안받아온 걸 뭐라고 하더군요. 주차장인지 알려주었어야 알텐데. 저는 차단기도 안내려져있고 안내도 안해주셔서 몰랐다고 하니본인은 이야기했다고(어이~라고 소리낸걸 말한건지) 제가 막무가내로 갔다고만 이야기하시고,차단기가 고장났다는 핑계만 대시고,본인이 차올때마다 일일이 다 알려줘야하냐고 되려 정색을 하시더군요. 본인 일을 망각하신건지.또 주차장도 바로 옆인데 내려서 알려줄 법도 한데 본인이 귀찮으셨던건지 남탓만 하는 행위가 참 꼴사납더군요. 저의 불만 사항은 아무리 나이가 드셨어도 기본적인 응대태도, """"""""어이~"""""""" 와 `반말`은 지양해주셨으면 하고,입구에 주차장 이용안내문이라도 비치하던지, 차단기가 고장났으면 바로고치던가, 고장안내문을 붙여놓는게 정상이 아닌지요.이런식으로 하면 저뿐만아니라 다른 사람들도 시장 가기가 더 꺼려질거라고 생각합니다.조속한 개선 부탁드립니다. ","2016-09-13","2016-09-13","2016-09-21","도시재생과","처리완료","부안읍"
484,"정말 해도해도 너무하는군요","정말 해도해도 너무하네요그렇게 몇번을 민원을 넣고 그렇게 말을 해도 나아지기는 커녕사람 불편하게 시간낭비하는것도 지긋지긋해 죽겠네요.익산시청 공무원들은 고작 이정도 밖에 안되는건지 뭐 하나를 말하면좀 제대로 좀 합시다.익산 중앙시장 호암마트 앞에 어항이고 뭐고 그 냄새나는것들때문에왔다갔다하는데 비위상하고 그리고 차까지 막히고 아니 거기서 자꾸 그런식이면이 글보는 담당자한테 확실하게 안해주면 인사혁신처에다가 소극행정으로 당신들 다 고발할테니제대로 좀 합시다. 제발좀!!!!!!!!!!!!!!!!!!!!!!!!!!!!!!!!!!!!!!!!!!!!!!!지긋지긋해 죽겠네 냄새가 차때문에 인도도 못다니고진짜 아우!!!!!!!!!!!!!!!!!!!!!!!!!!해당 게시물이 '부조리 신문고'에서 이동 되었습니다.","2016-03-14","2016-03-14","2016-03-16","민생경제과","처리완료","변산면"
485,"취업준비생 청년 무료 정장 대여 지원 사업","정말 억장 무너집니다 가슴이 아파요 눈물이 계속 나네요 아무것도 못먹고 이틀을 힘겹게 걸어와 앉아 있었을 하트를 생각하니 정말 눈물이 멈추질 않아요 힘들고 무서워서 가족을 기다리면서 두리번 거렸을 하트를 악마들이 인간으로서 할짓이 아닌 만행을 저질렀는데 그냥 단순한 벌금형 처벌로 끝나면 안된다고 생각합니다 강력하게 형이 내려져야 다시는 이런 일 안생깁니다 가중처벌도 부족합니다","2018-08-23",,"2018-09-05","기획예산과","처리완료","전주객사5길"
486,"(SPP-1703-2901313)예술회관 가로등 꺼짐","전라북도 부안군 부안읍 동중리 315-1주거단지 앞 파쉐석 방치도로 보행자 안전 위협","2017-03-29",,"2017-04-05","문화체육시설사업소","처리완료","부안읍"
487,"토사 유실로 인한 도로 배수로 정비","<불법광고물> 불법광고물 (1/1) G : 2018.08.03 19:40:13 A :  : I :   [  : 1522-0660 ()]","2018-08-06",,"2018-08-13","보안면","처리완료","부안읍"
488,"cctv 설치와 유도선 건의합니다.","이마트 4거리 CCTV설치를 부탁드립니다.제가 동산동에 살아서 사거리를 많이 이용하는데 4차선인 이마트진입로에 불법주차된 차들로 말미암아 삼례에서 주현우체국방향으로 우회전하는 차량들이 2차, 3차선으로 나오다보니 유턴차량이나 좌회전, 직진 차량들과의 사고위험이 굉장히 높습니다.CCTV설치를 부탁드리고, 동익산역에서 주현우체국방향으로 가는 직진길도 신호받고 건널 때, 차선이 그려져 있지 않아 삼례방향의 3차선에서 끼어들기도 하고 위험합니다.꼭 부탁드리겠습니다. 이쪽 길을 지날 때마다 가슴이 조마조마합니다. ","2017-04-17","2017-04-17","2017-04-20","교통행정과","처리완료","변산면"
489,"안녕하세요..건의 좀 드릴게요~^^","시장님!이런 부분을 적극 검토해 주시고 노력해 주시기 바랍니다.","2017-04-10","2017-04-10","2017-04-17","직소민원팀","처리완료","부안읍"
490,"사정동 금호1차  앞 주경기장 주차장","개정면 옥석신기길에 사는 주민입니다.작년에 시장님이 신경써 주셔서 면사무소와 마을주민들이 쓰레기를 치운적이 있습니다.시골길 자전거도로 대야방면 도로옆에 오래된 흙더미와 가구.철.피스등 각종 쓰레기들을 쌓아놓는 바람에 도로에 다시 쌓이고 있습니다.올해도 자동차 타이어파손이 여러번 된적이 있어서 민원을 넣었는데 시청에선 답변이 안된다고만하고 자원순환계에 작년부터 올해까지 쓰레기와 문제가 되는 흙더미를  치워달라 또 민원을 제기했지만 시골이라 또 안된다하고 올해엔 시청땅으로 안 들어가니 올해도 못 도와준다 합니다.높게 쌓인 흙더미만이라도 넓게 펼쳐 놓으면 도로와 논수로에 쓰레기가 넘어오는 것은 막을수 있을겁니다.흙더미 만이라도 평탄작업을 해 주셨으면 합니다.","2018-03-28","2018-03-28","2018-03-30","체육진흥과","처리완료","부안읍"
491,,"공익을 목적으로 사용중인 토지의 부안군 매수 질의*스캔 참고",,,"공원녹지법 NA","공원녹지법 NA NA",,"상원길"
492,"(안전보안관)(SPP-1806-2600138)하수구 위 물건좀 치워주세요 장마입니다 * 첨부파일촬","전라북도 부안군 부안읍 봉덕리 574-91횡단보도위 주차 처벌해주세요*  *(1/2) C: 2018/06/25 15:30:46(2/2) C: 2018/06/25 15:30:56G:  *","2018-06-26",,"2018-07-04","친환경축산과","처리완료","부안읍"
493,"중앙선 페인트가 색이 바랬습니다.",": 전라북도 부안군 보안면 상림리 127-1가로등 불이 안들어와요-------------------------------------------------------------------------------------------------------------------------○ .20180328_100946_resized.jpg","2018-03-30",,"2018-04-02","건설교통과","처리완료","부안읍"
494,"칭찬합니다.","익산시 유기견 보호소 에서  대체 유기견을 보호하고 주인을 찾아주려는 마음은 있으신건가요 ? 아님 그냥  대충 주인잃은 아이을 끌어 모아다 뜬장에 집어 넣어놓고 공고 기간이 지나면 안락사 해버리기 위한 장소로 만든것 입니까 ?여러장의 사진을 보았습니다 .  제가 주인이라고 해도 제 강아지라고 알수 없는 사진을 올리고 심지어  막대기로 강아지를 제압하고 목덜미를 들어 고통스러워 하는사진을 올리시던데  조심해 주세요 정말 화가납니다 ..유기견 보호소란 곳이 왜 있는건지 생각해보세요 ...지금 그곳의 상황은 개장수만도 못 해보입니다","2016-11-08","2016-11-08","2016-11-10","시정에바란다","처리완료","부안읍"
495,"내소사 입장료에 대해서...","(유)에스엠산업 적지복구 촉구 통보* 스캠 참고","2017-09-04",,"2017-09-06","문화관광과","처리완료","부안읍"
496,"사유지 주차문제","안녕하십니까?아침 출근길 누구나 바쁩니다.영등제일1차 상가 본죽 앞 주차된 차량으로 우회전 못하는 차량으로 도로가 주차장 방불케 되였습니다.","2018-05-11","2018-05-11","2018-05-15","교통행정과","처리완료","태진로"
497,"김제시청 중요 시설물에 QR코드 설치(시민들이 알권리 실현)","김제시 최초 탄생 한눈에 바로 보기!!","2017-09-19",,"2017-10-17","안전총괄과","처리완료","부안읍"
498,"청사 및 의회건물 내 계단피난 이송기구 비치","정화시설이 없는 바닥분수 고지","2016-04-19",,"2016-05-09","회계과","처리완료","부안읍"
499,"변산면 마포리 산86-125 공사로 인한 작물피해","<불법주정차> 인도 및 횡단보도 불법주차[  : 승리약국 앞 ] (1/2) I : 2017.12.12 17:37:07 (2/2) I : 2017.12.12 17:37:16 A :  : I :  .[ (02-2195-1129~30)]","2017-12-29",,"2018-01-09","민원소통과","처리완료","부안읍"
500,"익산에서 체육복지서비스를 이용하고 싶습니다.(야구 및 기타)","중앙동(창인동)에서 장사를 하고있는 시민입니다저녁에 메뚜기 같은 벌레때문에 영업을 지속할수 없습니다아침에  쓸어 담는양이 쓰레받이로 한가득입니다매일 방역을 요청합니다","2018-06-29","2018-06-29","2018-07-02","체육진흥과","처리완료","부안읍"
501,"도로 정비","전라북도 부안군 동진면 봉황리 503-21신봉마을 방지턱이 너무높아 차가 자꾸 부딪히네요*  *(1/2) G: 2017/08/10 14:55:34(2/2) G: 2017/08/10 14:55:33G:*","2017-08-11",,"2017-08-22","계화면","처리완료","부안읍"
502,"노인일자리","어제 인터넷 선로 작업을 하던데요세로운 선을 연결하고 기존에있던선들은  전봇데에 묶어 놓아 보기싫은데업체에서 철거해야 하지 않을까요시청에서 업체들의  선로 정리를조치.단속하지 않는지요참고로 사진은 sk선로인듯 합니다","2016-08-29","2016-08-29","2016-08-31","직소민원팀","처리완료","부안읍"
503,"강아지 운동장","강아지 운동장을 만들어주세요 강아지와 함께 뛰어 놀고 싶어요 ㅠㅠ","2017-03-27","2017-03-27","2017-03-29","체육진흥과","처리완료","변산면"
504,"보도 위 각종 배너,현수막등 불법광고물로 생명의 위협","안녕하세요?아픈 중증 장애아를 키우고 있는 엄마 입니다.장애인 콜택시를 이용한지도 벌써 11년차가 되어 갑니다.두대부터 시작해서 4대 지금은 무려 19대까지 늘어났습니다.늘어난만큼 서비스도 향상 되었으면 합니다.콜택시 예약잡는 분의 무성의 불친절 이런것은 괜찮습니다.실수라고 하기에는 한두번도 아니고 매번 반복되고 있어 치료 30분을 받기위해 가는 아픈아이의 엄마들의 마음에 피멍을 들이고 있습니다.예약을 했음에도 불구하고 안잡은 경우도 허다하며 사과는 커녕 그럴수도 있죠? 보내드릴께요~ 이런일이 반복돼서 대부분 콜택시 아저씨분들이 일찍 오셔서 기다리셔서 안와있으면  예약됐는지 확인 해달라고 전화하면  `아마 그쪽에서 출발했을거에요~ 진짜 안와서 전화하면 왜 안됐지? 보내드릴께요~ 사과 한마디 없이 끊습니다. 이런식으로 치료를 제대로 못 받은 횟수가 많음에도 불구하고 늘 이런식입니다.또한 차량이 19대로 늘었음에도 불구하고 복지관 치료 끝나는 11시 40분부터 원대병원 치료시작하는 1시 30분 사이에는 점심시간 이라는 이유로 이용을 못하며 복지관에서 거의 한시간 반을 기다려 일반택시로 이용해야 하는 불편함이 말로 할 수가 없습니다.장애인들의 불편함을 해소하고 장애인들의 발이 되어 치료든 어디든 갈 수 있어야 되는게 아닌가요? 점심시간에 꼭 기사분 19분들이 동시에 밥을 먹어야 되는지? 2교대로 드시면서 장애인들이 이용 할 수는 없나요?장애인 콜택시가 사전 예약제로 운영되고 있어서 제대로 잡힌 경우보단 안 된 경우가 많습니다. 콜예약을 하면  예약알림 문자 서비스로 이런 불편함을 덜어 주셨으면 합니다.저뿐만 아니라 장애아를 키우는 많은 엄마들이 콜잡는 분의 무능력과 불친절함에 많이 불편해 하고 있습니다.아픈아이를 키우다 보면 물론 좋으신 분들도 많으시겠지만 장애인들에 대한 무시와 차별을  많이 받고 있습니다.. 장애인들을 위한 콜택시인 만큼 어떤 사회보다 장애인들의 불편함에 귀를 기울이시고 더 많은 장애인들이 장애인콜택시를 편안하게 예약 잡고 이용 할 수 있게 해 주시길 간곡히 부탁드립니다.","2017-03-03","2017-03-03","2017-03-07","도로공원과","처리완료","부안읍"
505,"고려온천아파트 하수 지하수","익산역 지하차도 內 동물이 싫어하는 초음파, 안내 문구 등 설치로 사고 예방 조치를 취해주세요.2016년11월18일 이후익산역 지하차도로 출퇴근을 하고 있었는데,11월23일 3개월 추정된 새끼 고양이가 노란선 안쪽 성인 한뼘정도 되는 공간에 앉아 있는 아이를 구조했습니다.교통사고를 당했는지 뒷다리를 끌고 있어 바로 병원에서 엑스레이를 찍고다행히 성장하는 아이라서 사고도 심하지 않아, 활동을 제한할 수 있는 작은 공간에 생활하게하면 뼈가 붙어,다행히 걷는데 지장이 없을 것이라는 얘기를 듣고, 제가 통원치료 및 보호하고 있었습니다. 12월19일 또 사고당한 고양이를 지나치지 못하고 유턴해 돌아와서 구조하였습니다.성묘로 보이는 두번째 아이도 바로 병원으로 가 엑스레이를 찍었는데외과수술을 하지 않으면 부러진 뼈가 대장과 방광을 눌러 배설이 어렵고, 보행이 불가하다고 했습니다.병원비는 350만원이라고, 하루 고민을 하고 수술을 진행했습니다. 두 아이를 만난 이후로는 출퇴근이 빠르지만 더이상 익산역 지하차도를 갈 수 없게되었습니다.개통된지 한달밖에 안된 곳에서 다친 아이들 둘을 만났고제가 보지 못한 죽은아이들도 있을 것이며, 앞으로도  다친아이가 있으면 또 지나칠 수 없는걸 알기에먼길을 돌아 출퇴근을 합니다.더이상 익산역 지하차도에서 로드킬이 없었으면 좋겠습니다.찾아보니 강아지, 고양이 등 동물들이 싫어하는 초음파가 있다고 하는데,사람 귀에는 그 초음파를 인지할 수 없기에 사람과는 무관하니,그렇게라도 아이들을 보호해주셨으면 좋겠습니다.갓길이 공간이 너무 없어 고양이나 강아지 가 차도 안으로 들어오면 죽거나 다치거나 둘중 하나의 상황 밖에는있을 수 없는 상황입니다.동물이 있을 수 있으니 갓길을 잘 살펴 달라는 안내문구도 되어 있으면 좋겠습니다.물론 운전자도 아이들을 피하려고 사고가 날 수 있고, 또 그로인해 2차사고로 이어질 수 있는 상황이 다분합니다.오랜시간 걸려 개통된 지하차도에서 운전자와 소중한 생명들이 위험하지 않도록 도와주세요.","2018-09-28","2018-09-28",,,"처리중","소태정로"
506,"인도파손","1950년경에 건축한 마을모정의 노후로 안전에 문제가 발생하여 부안군에 수리 또는 철거를 요구한 바, 불수용입니다. 불수용 사유 : 1. 현재 부안군 상서면 장동리 111-3 소재 모정은 지자체 보조로 건립된 건축물이 아닌 개인 및 마을주민들의 사유재산이라 불가 2. 수리는 부안군 마을회관 등에 관한 지원조례(2015.11.06제정, 2015.11.08시행) 위배 3. 철거는 모정 토지 소유주와 마을 주민 협의하에 처리하라는 내용입니다.* 알고 싶은 사항 1. 1950년대는 지지체에서 보조로 건립한 모정은 한 곳도 없으며, 마을 모정은 공익 시설인데 부안군은 마을에서 알아서 처리해야 하는가? 2. 안전 사고 발생하면 부안군은 책임이 없는가? 3. 모정 토지 및 진입로는 사유지로 토지 소유주와 아무련 협의 없이 콘크리트 포장을 하였는데 사유재산권 침해가 아난가?","2017-06-14",,"2017-06-23","푸른도시과","처리완료","부안읍"
507,"익산 유기견보호소","너무 늦은시간이라 전화는 못 하고 글로 올립니다.인터넷에서 아가들 사진 보고 기겁했습니다.시에서 운영하는 보호소가 맞습니까?그냥 돈 때문에 하는 게 아니고요?말 못 하는 애들이라고 진짜 너무들 하시네요발보다 훨씬 큰 철장뿐만 아니라 막대기는 도대체 뭡니까?그리고 직접 와서 해보라고요? 아니 세상에 말도 안 나옵니다당신 애기들이면 그렇게 할 수 있어요? 머리채 잡고 사진 찍을 수 있냐는 말입니다.제발 입장바꿔서 생각해보시길 바랍니다.지금도 어디에선가 울고불고 저 아가들 찾을 주인분들 마음을 생각하니까 눈물나는데 시에서 운영하는 보호소가 저렇다니. 흐지부지 넘기시지 마시고 제대로 된 처리 부탁드립니다.익산의 이미지에도 큰 타격입니다.","2016-11-09","2016-11-09","2016-11-10","축산과","처리완료","부안읍"
508,"부안군청의 기간제 선발 방식에 대한 문의","익산 배산우림한솔아파트 사는 주민입니다.주말만 되면 그일대가 결혼식때문에 마비가 되죠.전에도 몇번 단속 요청하고 담당자랑 통화했는데 인력탓이랑 그리고 거기가 식당구역이라 점심시간에는 1~2시간 주차허용된다더군요...그래도 참았죠..하지만 계속 아파트 입구까지 양쪽차서 막아서는 차량때문에 다닐수 가 없어요.거기에 불법주정차 차량 신고하라고 써있어 몇대 찍어보냅니다.근데 웨딩홀 앞이 왜 식당구역이죠? 저도 이동네 오래살았는데 점심먹으로 웨딩홀로 누가가나요? 공무원여러분들도 점심 먹으로 간적 있나요? 그리고 예산이 많이 들어 CCTV나 무인단속기 설치 어렵다는데 거기 한달만 찍어 벌금 거두면 해결되겠더라구요..항의나 표가 무서워 단속안하시는건지..정말 인력이 없고 하기싫으시면 요즘 공무원하고싶은젊은이들 줄 섰어요..뽑아서 그분들 쓰세요..하기 싫은 분들은 그만두시고..만약 여러분 아파트 입구가 막혀 차 못다니면 한두번도 아니고 매주 이러면 어쩔실건가요? 이번에 이렇게 글써서 해결안되면 이젠 시장님 메일이나 페이스북으로 사진 및 글띄울께요..아님 담당 시의원님들께 도움 요청할수 밖에요.그리고 찍어보내는 차량들 불법주정차 처리 부탁합니다.제발 큰도로까지는 이해할께요..그래도 아파트에 사는 저희 주민들이 왜 못다니는지..그럴바엔 차라리 도로를 하나 더 뚫어주세요.","2017-05-04",,"2017-05-15","자치행정과","처리완료","호성로"
